{
  "schema_version": 1,
  "record_type": "experience_candidate",
  "experience_id": "exp-b9dd69e9c62c4d2da7e322999ebe822c",
  "status": "candidate",
  "created_at": "2026-08-12T05:56:24.7844652+00:00",
  "updated_at": "2026-08-12T05:56:24.7844652+00:00",
  "payload_sha256": "1C111A13C9D89D758244A54382E68A899304A5F3F74D2FADE173BAF89AF618F2",
  "title": "Windows 目录有两个名字：容器判断前必须归一化成长名",
  "summary": "Windows 给同一个目录一个长名和一个 8.3 短名；脚本里所有「这个路径在不在那个目录里」的判断若直接做字符串前缀比较，短名和长名对不上，一个合法路径会被判成越界、相对路径还会被从名字中间切断。动手比较前，先把每个根按段用目录枚举解析成长名再比。",
  "category": "tooling",
  "tags": [
    "windows",
    "powershell",
    "path-normalization",
    "short-path",
    "portability"
  ],
  "source_evidence": [
    {
      "source_id": "src-6609e7b3d09c48c6983d82c4acc7fa2a",
      "source_kind": "fixture",
      "evidence_role": "supporting",
      "artifact_kind": "ps1",
      "evidence_proof_id": "proof-67c50d62ed7e47f4979f4bf7745c2bb6",
      "evidence_level": "failure_observed"
    }
  ],
  "pattern": {
    "applicability": [
      "脚本在 Windows 上对路径做包含或前缀判断",
      "路径可能来自不同来源：一个 API 保留短名，另一个把它展开成长名"
    ],
    "detection": [
      "同一个目录，一个 API 返回带波浪线加数字的段（例如以 ~1 结尾），另一个返回展开后的长名",
      "同一路径两次解析得到不同拼写"
    ],
    "negative_indicators": [
      "卷已关闭 8.3 短名生成时不会触发",
      "路径只在单一 API 内部使用、从不跨来源传递时不受影响"
    ],
    "procedure": [
      "把每个根路径按段用目录枚举（按名过滤）解析成长名之后再比较",
      "所有容器判断统一走归一化后的路径，不再直接比原始输入"
    ],
    "verification": [
      "用系统工具造一个真实的 8.3 别名目录，把产品放进去跑校验，应判为合法且不报越界",
      "去掉归一化这一步，同一条用例必须立刻变红"
    ],
    "rollback": [
      "归一化只改用于比较的字符串，删掉它即恢复旧行为，不触碰磁盘内容"
    ],
    "failure_signals": [
      "一个合法路径被判成「逃出了自己的目录」",
      "相对路径被从名字中间切开"
    ],
    "stop_conditions": [
      "某一段目录无法枚举时，退回原始拼写，不要猜测长名"
    ],
    "limitations": [
      "只覆盖 Windows 的 8.3 别名；不处理符号链接或其它别名机制"
    ]
  },
  "sanitization": {
    "automatic_scan": "passed",
    "reviewed_status": "pending",
    "scan_version": 1,
    "checked_at": "2026-08-12T05:56:24.7844652+00:00",
    "payload_sha256": "1C111A13C9D89D758244A54382E68A899304A5F3F74D2FADE173BAF89AF618F2",
    "findings": []
  },
  "reviews": []
}
